{
  "$schema": "https://json-schema.org/draft/2020-12/schema",
  "title": "USVisaHumanReviewQueueRecord",
  "type": "object",
  "required": [
    "visa_code",
    "field_in_question",
    "issue_type",
    "source_urls",
    "codex_extracted_value",
    "reason",
    "recommended_action"
  ],
  "properties": {
    "visa_code": {
      "type": "string",
      "minLength": 1
    },
    "field_in_question": {
      "type": "string",
      "minLength": 1
    },
    "issue_type": {
      "type": "string",
      "minLength": 1
    },
    "source_urls": {
      "type": "array",
      "minItems": 1,
      "items": {
        "type": "string",
        "pattern": "^https://"
      }
    },
    "codex_extracted_value": {},
    "reason": {
      "type": "string",
      "minLength": 1
    },
    "recommended_action": {
      "type": "string",
      "minLength": 1
    }
  }
}
